[
  {
    "slug": "esteban-calzetta",
    "name": "Esteban Calzetta",
    "category": "pi",
    "role": {
      "es": "Investigador Principal",
      "en": "Principal Researcher"
    },
    "display_name_normalized": "esteban calzetta",
    "contact": {
      "email": "calzetta@df.uba.ar",
      "orcid": "0000-0001-7842-3105",
      "office": "Oficina 2161 2do piso, Dpto. de Física, Pabellón 1"
    },
    "social_links": [
      {
        "platform": "orcid",
        "url": "https://orcid.org/0000-0001-7842-3105"
      }
    ],
    "photo": "people/Esteban_C.png",
    "inspirehep_id": "E.Calzetta.1",
    "orcid_id": "0000-0002-3083-3420",
    "teaching_role": {
      "es": "Profesor Emérito",
      "en": "Professor Emeritus"
    }
  },
  {
    "slug": "diana-lopez-nacir",
    "name": "Diana López Nacir",
    "category": "pi",
    "role": {
      "es": "Investigadora Independiente",
      "en": "Independent Researcher"
    },
    "display_name_normalized": "diana lopez nacir",
    "contact": {
      "email": "dnacir@df.uba.ar",
      "orcid": "0000-0001-5533-9821",
      "office": "Oficina 2142, 2do piso, Dpto. de Física, Pabellón 1"
    },
    "social_links": [
      {
        "platform": "orcid",
        "url": "https://orcid.org/0000-0001-5533-9821"
      }
    ],
    "photo": "people/Diana_LN.png",
    "inspirehep_id": "D.Lopez.Nacir.1",
    "orcid_id": "0000-0003-4398-1147",
    "teaching_role": {
      "es": "Profesora Adjunta",
      "en": "Adjunct Professor"
    }
  },
  {
    "slug": "susana-landau",
    "name": "Susana Landau",
    "category": "pi",
    "role": {
      "es": "Investigadora Independiente",
      "en": "Independent Researcher"
    },
    "display_name_normalized": "susana landau",
    "contact": {
      "email": "slandau@df.uba.ar",
      "orcid": "0000-0002-4411-8732",
      "office": "Oficina 2173, 2do piso, Dpto. de Física, Pabellón 1"
    },
    "social_links": [
      {
        "platform": "orcid",
        "url": "https://orcid.org/0000-0002-4411-8732"
      }
    ],
    "photo": "people/susana_landau_foto.jpg",
    "inspirehep_id": "S.J.Landau.1",
    "orcid_id": "0000-0003-2645-9197",
    "research_interests": [
      {
        "es": "Análisis de Datos e Inferencia",
        "en": "Análisis de Datos e Inferencia"
      },
      {
        "es": "Inteligencia Artificial",
        "en": "Inteligencia Artificial"
      },
      {
        "es": "Gravedad Modificada",
        "en": "Gravedad Modificada"
      }
    ]
  },
  {
    "slug": "cecilia-scannapieco",
    "name": "Cecilia Scannapieco",
    "category": "pi",
    "role": {
      "es": "Investigadora Independiente",
      "en": "Independent Researcher"
    },
    "display_name_normalized": "cecilia scannapieco",
    "contact": {
      "email": "cscannapieco@df.uba.ar",
      "office": "Oficina 2177, 2do piso, Dpto. de Física, Pabellón 1"
    },
    "social_links": [],
    "photo": "people/Cecilia_C.png",
    "inspirehep_id": "C.Scannapieco.2",
    "orcid_id": "0000-0003-0376-333X",
    "research_interests": [
      {
        "es": "Simulaciones cosmológicas de la evolución de galaxias",
        "en": "Simulaciones cosmológicas de la evolución de galaxias"
      },
      {
        "es": "Formación de discos galácticos",
        "en": "Formación de discos galácticos"
      },
      {
        "es": "Evolución química de galaxias",
        "en": "Evolución química de galaxias"
      }
    ],
    "teaching_role": {
      "es": "Jefa de Trabajos Prácticos",
      "en": "Head of Practical Works"
    }
  },
  {
    "slug": "claudio-simeone",
    "name": "Claudio Simeone",
    "category": "pi",
    "role": {
      "es": "Investigador Independiente",
      "en": "Independent Researcher"
    },
    "display_name_normalized": "claudio simeone",
    "contact": {
      "email": "csimeone@df.uba.ar"
    },
    "social_links": [],
    "photo": "people/claudio-simeone.svg"
  },
  {
    "slug": "nahuel-miron-granese",
    "name": "Nahuel Mirón Granese",
    "category": "pi",
    "role": {
      "es": "Investigador",
      "en": "Researcher"
    },
    "display_name_normalized": "nahuel miron granese",
    "contact": {
      "email": "nahuelmg@df.uba.ar",
      "orcid": "0000-0003-0770-1865",
      "office": "Oficina 2166 2do piso, Dpto. de Física, Pabellón 1"
    },
    "social_links": [],
    "photo": "people/nmg.jpg",
    "inspirehep_id": "N.MironGranese.1",
    "orcid_id": "0000-0003-0770-1865",
    "teaching_role": {
      "es": "Jefe de Trabajos Prácticos",
      "en": "Head of Practical Works"
    }
  },
  {
    "slug": "javier-badia",
    "name": "Javier Badía",
    "category": "postdoc",
    "role": {
      "es": "Posdoc",
      "en": "Postdoctoral Researcher"
    },
    "display_name_normalized": "javier badia",
    "contact": {
      "email": "j.badia@df.uba.ar",
      "office": "Oficina 2.024"
    },
    "social_links": [],
    "photo": "people/Javier_B.jpeg",
    "inspirehep_id": "J.Badia.1",
    "orcid_id": "0000-0002-9095-9594",
    "teaching_role": {
      "es": "Jefe de Trabajos Prácticos",
      "en": "Head of Practical Works"
    }
  },
  {
    "slug": "tomas-ferreira-chase",
    "name": "Tomas Ferreira Chase",
    "category": "phd",
    "role": {
      "es": "Estudiante de doctorado",
      "en": "PhD Student"
    },
    "display_name_normalized": "tomas ferreira chase",
    "contact": {
      "email": "tomas.ferreirachase@df.uba.ar"
    },
    "social_links": [],
    "photo": "people/Tomas_C.png",
    "inspirehep_id": "Tomas.F.Chase.1",
    "orcid_id": "0009-0001-0286-2136",
    "teaching_role": {
      "es": "Ayudante de primera",
      "en": "First-rank Teaching Assistant"
    }
  },
  {
    "slug": "matias-leizerovich",
    "name": "Matias Leizerovich",
    "category": "phd",
    "role": {
      "es": "Estudiante de doctorado",
      "en": "PhD Student"
    },
    "display_name_normalized": "matias leizerovich",
    "contact": {
      "email": "matias.leizerovich@df.uba.ar"
    },
    "social_links": [],
    "photo": "people/Matias_L.png",
    "inspirehep_id": "M.Leizerovich.1",
    "orcid_id": "0000-0002-6438-2285",
    "teaching_role": {
      "es": "Ayudante de primera",
      "en": "First-rank Teaching Assistant"
    }
  },
  {
    "slug": "guadalupe-ahumada-acuna",
    "name": "Guadalupe Ahumada Acuña",
    "category": "phd",
    "role": {
      "es": "Estudiante de doctorado",
      "en": "PhD Student"
    },
    "display_name_normalized": "guadalupe ahumada acuna",
    "contact": {
      "email": "guadalupe.ahumada@df.uba.ar"
    },
    "social_links": []
  },
  {
    "slug": "gonzalo-santa-cruz",
    "name": "Gonzalo Santa Cruz",
    "category": "phd",
    "role": {
      "es": "Estudiante de doctorado",
      "en": "PhD Student"
    },
    "display_name_normalized": "gonzalo santa cruz",
    "contact": {
      "email": "gonzalo.santacruz@df.uba.ar"
    },
    "social_links": [],
    "photo": "people/Gonzalo_SC.png",
    "teaching_role": {
      "es": "Ayudante de primera",
      "en": "First-rank Teaching Assistant"
    }
  },
  {
    "slug": "juan-pablo-elia",
    "name": "Juan Pablo Elia",
    "category": "phd",
    "role": {
      "es": "Estudiante de doctorado",
      "en": "PhD Student"
    },
    "display_name_normalized": "juan pablo elia",
    "contact": {
      "email": "juanpablo.elia@df.uba.ar"
    },
    "social_links": [],
    "photo": "people/juanpabloelia.jpeg"
  },
  {
    "slug": "augusto-chantada",
    "name": "Augusto Chantada",
    "category": "phd",
    "role": {
      "es": "Estudiante de doctorado",
      "en": "PhD Student"
    },
    "display_name_normalized": "augusto chantada",
    "contact": {
      "email": "a.chantada@df.uba.ar"
    },
    "social_links": [],
    "inspirehep_id": "A.T.Chantada.1",
    "orcid_id": "0000-0002-4480-9595",
    "teaching_role": {
      "es": "Ayudante de primera",
      "en": "First-rank Teaching Assistant"
    }
  },
  {
    "slug": "luis-biaus",
    "name": "Luis Biaus",
    "category": "phd",
    "role": {
      "es": "Estudiante de doctorado",
      "en": "PhD Student"
    },
    "display_name_normalized": "luis biaus",
    "contact": {
      "email": "lbiaus@df.uba.ar",
      "office": "Oficina 2.133"
    },
    "social_links": []
  },
  {
    "slug": "ezequiel-lozano",
    "name": "Ezequiel Lozano",
    "category": "phd",
    "role": {
      "es": "Estudiante de doctorado",
      "en": "PhD Student"
    },
    "display_name_normalized": "ezequiel lozano",
    "contact": {
      "email": "elozano@df.uba.ar"
    },
    "social_links": [],
    "photo": "people/Ezequiel_L.jpeg"
  },
  {
    "slug": "federico-huxhagen",
    "name": "Federico Huxhagen",
    "category": "phd",
    "role": {
      "es": "Estudiante de doctorado",
      "en": "PhD Student"
    },
    "display_name_normalized": "federico huxhagen",
    "contact": {},
    "social_links": [],
    "teaching_role": {
      "es": "Ayudante de primera",
      "en": "First-rank Teaching Assistant"
    }
  },
  {
    "slug": "martin-castelli",
    "name": "Martin Castelli",
    "category": "undergrad",
    "role": {
      "es": "Estudiante de licenciatura",
      "en": "Undergraduate Student"
    },
    "display_name_normalized": "martin castelli",
    "contact": {},
    "social_links": [],
    "photo": "people/martin_castelli.JPG"
  },
  {
    "slug": "joaquin-sequeira",
    "name": "Joaquín Sequeira",
    "category": "undergrad",
    "role": {
      "es": "Estudiante de licenciatura",
      "en": "Undergraduate Student"
    },
    "display_name_normalized": "joaquin sequeira",
    "contact": {},
    "social_links": []
  },
  {
    "slug": "santiago-iannucci",
    "name": "Santiago Iannucci",
    "category": "undergrad",
    "role": {
      "es": "Estudiante de licenciatura",
      "en": "Undergraduate Student"
    },
    "display_name_normalized": "santiago iannucci",
    "contact": {},
    "social_links": []
  },
  {
    "slug": "santiago-paramio",
    "name": "Santiago Paramio",